Incident #,Date,Time,Location,Description,Beat,Disposition
2603230001,03/23/2026,00:10,00,BLK IDORA AV POLICE COLLABORATE TRANSFER 2 REFERRED TO,ANOTHER,AGENCY
2603230002,03/23/2026,00:20,100,BLK AMADOR ST TRANSPORT ARRESTED PERSON 4 GENERAL,SERVICE,PROVIDED
2603230003,03/23/2026,00:22,100,BLK KATHY ELLEN DR VEHICLE TAMPERING JUST OCCURRED 1 UNABLE,TO,LOCATE
2603230004,03/23/2026,00:35,500,BLK SHELDON AV AREA CHECK 2 UNABLE,TO,LOCATE
2603230005,03/23/2026,00:44,900,BLK LASSEN ST CHILD MOLESTATION REPORT,2,REPORT
2603230006,03/23/2026,00:46,900,BLK LIGHTHOUSE CT 6 UNABLE,TO,LOCATE
2603230007,03/23/2026,01:30,00,BLK ROTARY WY AUDIBLE ALARM,1,UNFOUNDED
2603230010,03/23/2026,01:55,VERVAIS,AV/SPRINGS RD TRAFFIC STOP,2,ARREST
2603230011,03/23/2026,02:31,WILSON,AV/FARRAGUT AV TRAFFIC STOP 6,WARNING,GIVEN
2603230012,03/23/2026,02:43,500,BLK SANTA CLARA ST TRAFFIC STOP,6,CITATION
2603230014,03/23/2026,03:50,LEWIS,BROWN RD/SONOMA BL TRAFFIC STOP 7,WARNING,GIVEN
2603230015,03/23/2026,03:57,600,BLK INDIANA ST NOISE COMPLAINT 5 UNABLE,TO,LOCATE
2603230016,03/23/2026,04:01,300,BLK PARKVIEW TER ARSON,7,REPORT
2603230019,03/23/2026,04:44,100,BLK CYNTHIA AV RAVEN ALERT SHOTS FIRED 8 UNABLE,TO,LOCATE
2603230022,03/23/2026,05:13,2400,BLK SONOMA BL CORONER'S CASE,5,REPORT
2603230023,03/23/2026,05:21,DEL,SUR ST/MAGAZINE ST PHYSICAL FIGHT 3 UNABLE,TO,LOCATE
2603230024,03/23/2026,05:22,SONOMA,BL/FLORIDA ST MISDEMEANOR HIT AND RUN REPORT 5 GENERAL,SERVICE,PROVIDED
2603230027,03/23/2026,06:00,1900,BLK LOUISIANA ST INTEGRATED HEALTH AND RESPONSE TEAM 5,DUPLICATE,CALL
2603230028,03/23/2026,06:00,1900,BLK LOUISIANA ST INTEGRATED HEALTH AND RESPONSE TEAM 5 UNABLE,TO,LOCATE
2603230029,03/23/2026,06:05,1200,BLK TENNESSEE ST SUSP CIRCUMSTANCES,5,REPORT
2603230031,03/23/2026,07:00,300,BLK PARKVIEW TER INTEGRATED HEALTH AND RESPONSE TEAM 7 MH TEAM,-IHART,PRIMARY
2603230032,03/23/2026,07:00,200,BLK COVENTRY WY 911 HANGUP 2 CANCELLED BY,REPORTING,PARTY
2603230033,03/23/2026,07:05,1800,BLK SPRINGS RD AUDIBLE ALARM,2,UNFOUNDED
2603230034,03/23/2026,07:24,1200,BLK EL DORADO ST SUSPICIOUS VEHICLE CHECK 5 UNABLE,TO,LOCATE
2603230035,03/23/2026,07:25,100,BLK JOEL CT PANIC ALARM,2,UNFOUNDED
2603230036,03/23/2026,07:35,MEADOWS,DR/ECHO SUMMIT RD TRAFFIC COLLISION WITH INJURIES,8,REPORT
2603230036,03/23/2026,07:35,MEADOWS,DR/ECHO SUMMIT RD TRAFFIC COLLISION WITH MINOR INJURIES,8,REPORT
2603230037,03/23/2026,07:35,CURTOLA,PKWY/ALAMEDA ST TRAFFIC COLLISION WITH INJURIES,4,REPORT
2603230037,03/23/2026,07:35,CURTOLA,PKWY/ALAMEDA ST TRAFFIC COLLISION WITH MINOR INJURIES,4,REPORT
Total,172,Records,Page,1 of 6 Updated @ 3/28/2026,3:20:00,AM
2603230040,03/23/2026,07:44,1100,BLK PINE ST THREATS 4 GENERAL,SERVICE,PROVIDED
2603230041,03/23/2026,07:57,600,BLK SACRAMENTO ST 911 HANGUP 6 UNABLE,TO,LOCATE
2603230042,03/23/2026,08:08,1700,BLK TUOLUMNE ST WELFARE CHECK / 911 HANGUP 7 CANCELLED BY,REPORTING,PARTY
2603230044,03/23/2026,08:26,100,BLK MAYWOOD DR MISSING PERSON,2,REPORT
2603230045,03/23/2026,08:29,00,BLK B ST ABANDONED VEHICLE,6,REPORT
2603230047,03/23/2026,08:54,400,BLK DEL SUR ST ASSAULT REPORT 3 GENERAL,SERVICE,PROVIDED
2603230048,03/23/2026,08:55,600,BLK SACRAMENTO ST 911 HANGUP 6 CANCELLED,BY,DISPATCH
2603230049,03/23/2026,08:56,400,BLK LAUREL ST ASSAULT JUST OCCURRED 2,DUPLICATE,CALL
2603230052,03/23/2026,09:11,400,BLK LINCOLN RD E ASSAULT JUST OCCURRED,2,ARREST
2603230053,03/23/2026,09:11,500,BLK MINI DR WELFARE CHECK / 911 HANGUP 8 CANCELLED,BY,DISPATCH
2603230054,03/23/2026,09:15,100,BLK RHEA CT SEND OFFICER COVER 8 REFERRED TO,ANOTHER,AGENCY
2603230055,03/23/2026,09:26,LEMON,ST/SONOMA BL TRAFFIC SIGNAL MALFUNCTION 4 REFERRED TO,ANOTHER,AGENCY
2603230056,03/23/2026,09:31,500,BLK OHIO ST VERBAL FIGHT 6 GENERAL,SERVICE,PROVIDED
2603230057,03/23/2026,09:32,1600,BLK SONOMA BL 911 HANGUP 4 UNABLE,TO,LOCATE
2603230060,03/23/2026,09:35,100,BLK LARISSA LN TRESPASS IN PROGRESS 4 GENERAL,SERVICE,PROVIDED
2603230061,03/23/2026,09:36,200,BLK CONTRA COSTA ST ABANDONED VEHICLE 5 GENERAL,SERVICE,PROVIDED
2603230062,03/23/2026,09:50,700,BLK LINCOLN RD W SUSPICIOUS PERSON 4,ALERT,BROADCAST
2603230064,03/23/2026,10:05,1800,BLK SONOMA BL INFORMATIONAL REPORT 6 CANCELLED,BY,DISPATCH
2603230065,03/23/2026,10:14,100,BLK HANNIGAN WY ABANDONED VEHICLE 8 GENERAL,SERVICE,PROVIDED
2603230066,03/23/2026,10:16,100,BLK DARTMOUTH AV AUDIBLE ALARM,8,UNFOUNDED
2603230067,03/23/2026,10:18,200,BLK ADMIRAL CALLAGHAN LN ASSAULT REPORT,1,REPORT
2603230068,03/23/2026,10:21,1700,BLK AMERICAN CANYON RD INFORMATIONAL REPORT CANCELLED BY,REPORTING,PARTY
2603230069,03/23/2026,10:22,300,BLK SAN MARCUS DR STALKING REPORT 4 GENERAL,SERVICE,PROVIDED
2603230071,03/23/2026,10:25,00,BLK BALDWIN ST 911 HANGUP 6 UNABLE,TO,LOCATE
2603230072,03/23/2026,10:32,200,BLK HANNIGAN WY ABANDONED VEHICLE,8,REPORT
2603230073,03/23/2026,10:47,1400,BLK ENTERPRISE ST ANIMAL CALL 7 REFERRED TO,ANOTHER,AGENCY
2603230075,03/23/2026,10:51,800,BLK ROSEWOOD AV AUDIBLE ALARM,2,UNFOUNDED
2603230076,03/23/2026,11:04,900,BLK ADMIRAL CALLAGHAN LN ANIMAL CRUELTY IN PROGRESS 1 REFERRED TO,ANOTHER,AGENCY
2603230077,03/23/2026,11:04,100,BLK AMADOR ST TRANSPORT ARRESTED PERSON,4,ARREST
Total,172,Records,Page,2 of 6 Updated @ 3/28/2026,3:20:00,AM
2603230078,03/23/2026,11:05,700,BLK CAROLINA ST 911 HANGUP 5 UNABLE,TO,LOCATE
2603230080,03/23/2026,11:07,00,BLK VALLE VISTA AV PHYSICAL FIGHT 6 GENERAL,SERVICE,PROVIDED
2603230081,03/23/2026,11:11,400,BLK WARFORD AV BRANDISHING A WEAPON 2 GENERAL,SERVICE,PROVIDED
2603230082,03/23/2026,11:14,300,BLK HOSPITAL DR AREA CHECK 7,ALERT,BROADCAST
2603230083,03/23/2026,11:16,200,BLK CORTLAND CIR NOISE COMPLAINT 8 GENERAL,SERVICE,PROVIDED
2603230085,03/23/2026,11:26,300,BLK TUOLUMNE ST 911 HANGUP 5 UNABLE,TO,LOCATE
2603230086,03/23/2026,11:31,7200,BLK SEAGLASS DR PETTY THEFT,2,REPORT
2603230087,03/23/2026,11:32,300,BLK TUOLUMNE ST AREA CHECK 5 UNABLE,TO,LOCATE
2603230088,03/23/2026,11:34,1500,BLK FLAGSHIP DR PARKING VIOLATION 6 CANCELLED BY,REPORTING,PARTY
2603230089,03/23/2026,11:45,500,BLK OREGON ST CHILD NEGLECT 5 GENERAL,SERVICE,PROVIDED
2603230090,03/23/2026,11:45,100,BLK CARNIVAL CT ABANDONED VEHICLE 8 GENERAL,SERVICE,PROVIDED
2603230091,03/23/2026,11:46,100,BLK GREENFIELD AV ABANDONED VEHICLE 5 GENERAL,SERVICE,PROVIDED
2603230092,03/23/2026,11:57,100,BLK PLATT CT CHILD MOLESTATION REPORT,7,REPORT
2603230093,03/23/2026,12:01,2300,BLK ALAMEDA ST MISC FRAUD 5 CANCELLED BY,REPORTING,PARTY
2603230095,03/23/2026,12:14,200,BLK GRAPEWOOD ST VERBAL FIGHT 2 GENERAL,SERVICE,PROVIDED
2603230096,03/23/2026,12:16,100,BLK ALABAMA ST PARKING VIOLATION,6,REPORT
2603230097,03/23/2026,12:17,400,BLK SHASTA ST ABANDONED VEHICLE 5 GENERAL,SERVICE,PROVIDED
2603230099,03/23/2026,12:26,1400,BLK GEORGIA ST 911 HANGUP 4 CANCELLED BY,REPORTING,PARTY
2603230100,03/23/2026,12:46,200,BLK AMADOR ST FOLLOW UP 4 MH TEAM,-IHART,PRIMARY
2603230102,03/23/2026,12:57,3600,BLK GEORGIA ST VEHICLE THEFT REPORT,2,REPORT
2603230104,03/23/2026,13:07,WILSON,AV/SAINT FRANCIS DR WELFARE CHECK 6 MH TEAM,-IHART,PRIMARY
2603230105,03/23/2026,13:11,1000,BLK PORTER ST CHILD ABUSE REPORT,4,REPORT
2603230106,03/23/2026,13:13,SACRAMENTO,ST/MAINE ST TRAFFIC STOP,6,ARREST
2603230107,03/23/2026,13:14,200,BLK FRISBIE ST ABANDONED VEHICLE 6 GENERAL,SERVICE,PROVIDED
2603230108,03/23/2026,13:14,ADMIRAL,CALLAGHAN LN/COLUMBUS PKY BOL INFO 1,ALERT,BROADCAST
2603230110,03/23/2026,13:23,K,ST/WALNUT AV TRAFFIC HAZARD 6 UNABLE,TO,LOCATE
2603230111,03/23/2026,13:24,300,BLK AMADOR ST TRESPASS IN PROGRESS 5 UNABLE,TO,LOCATE
2603230112,03/23/2026,13:25,1100,BLK ADMIRAL CALLAGHAN LN GRAND THEFT,1,REPORT
2603230113,03/23/2026,13:39,300,BLK FAIRGROUNDS DR STAKEOUT 7 CANCELLED BY,REPORTING,PARTY
Total,172,Records,Page,3 of 6 Updated @ 3/28/2026,3:20:00,AM
2603230114,03/23/2026,13:41,700,BLK LOUISIANA ST PARKING VIOLATION 5 UNABLE,TO,LOCATE
2603230116,03/23/2026,13:41,300,BLK RODGERS ST TRAFFIC CONTROL / STRUCTURE FIRE 6 REFERRED TO,ANOTHER,AGENCY
2603230117,03/23/2026,13:45,500,BLK SHELDON AV INTEGRATED HEALTH AND RESPONSE TEAM 2 MH TEAM,-IHART,PRIMARY
2603230120,03/23/2026,13:54,SACRAMENTO,ST/GEORGIA ST ABANDONED VEHICLE 6 GENERAL,SERVICE,PROVIDED
2603230121,03/23/2026,14:00,300,BLK FARRAGUT AV ABANDONED VEHICLE 6 GENERAL,SERVICE,PROVIDED
2603230122,03/23/2026,14:15,100,BLK AMADOR ST TRANSPORT ARRESTED PERSON 4 GENERAL,SERVICE,PROVIDED
2603230123,03/23/2026,14:17,SACRAMENTO,ST/FRISBIE ST SUSP CIRCUMSTANCES 6 CANCELLED BY,REPORTING,PARTY
2603230125,03/23/2026,14:26,900,BLK 5TH ST RAVEN ALERT SHOTS FIRED 4 UNABLE,TO,LOCATE
2603230126,03/23/2026,14:28,100,BLK GUAVA CT SUSPICIOUS PERSON 7 UNABLE,TO,LOCATE
2603230127,03/23/2026,14:30,200,BLK MAINE ST,THREATS,6
2603230128,03/23/2026,14:34,00,BLK MICHIGAN ST ABANDONED VEHICLE,5,REPORT
2603230129,03/23/2026,14:35,6700,BLK SUNRIVER LN THREATS 1 GENERAL,SERVICE,PROVIDED
2603230130,03/23/2026,14:36,00,BLK ADMIRAL CALLAGHAN LN CUSTOMER DISTURBANCE 1 GENERAL,SERVICE,PROVIDED
2603230131,03/23/2026,14:38,200,BLK GEORGIA ST TRESPASS IN PROGRESS 6 GENERAL,SERVICE,PROVIDED
2603230132,03/23/2026,14:40,WILSON,AV/SACRAMENTO ST RECKLESS DRIVER 6,ALERT,BROADCAST
2603230135,03/23/2026,14:57,1300,BLK ENSIGN AV MISSING JUVENILE 5 CANCELLED BY,REPORTING,PARTY
2603230136,03/23/2026,15:07,500,BLK RUSSELL ST SUSP CIRCUMSTANCES 2 CANCELLED BY,REPORTING,PARTY
2603230137,03/23/2026,15:09,400,BLK FAIRGROUNDS DR VERBAL FIGHT 7 GENERAL,SERVICE,PROVIDED
2603230138,03/23/2026,15:19,SOLANO,AV/CENTRAL AV MISDEMEANOR HIT AND RUN REPORT,4,REPORT
2603230139,03/23/2026,15:25,300,BLK AVIAN DR PETTY THEFT,2,REPORT
2603230140,03/23/2026,15:34,5100,BLK SONOMA BL DOMESTIC VIOLENCE IN PROGRESS,8,ARREST
2603230141,03/23/2026,15:37,1300,BLK ENSIGN AV CHILD ABUSE REPORT,5,REPORT
2603230142,03/23/2026,15:39,800,BLK BENICIA RD TRAFFIC HAZARD 2 GENERAL,SERVICE,PROVIDED
2603230144,03/23/2026,15:46,6700,BLK SUNRIVER LN ASSAULT REPORT,1,REPORT
2603230146,03/23/2026,16:02,1000,BLK SONOMA BL CUSTOMER DISTURBANCE 4 CANCELLED BY,REPORTING,PARTY
2603230147,03/23/2026,16:06,1800,BLK SONOMA BL VIOLATION OF COURT ORDER 6 GENERAL,SERVICE,PROVIDED
2603230148,03/23/2026,16:07,200,BLK MASONIC DR ABANDONED VEHICLE 1 GENERAL,SERVICE,PROVIDED
2603230149,03/23/2026,16:12,900,BLK LIGHTHOUSE CT,6,ARREST
Total,172,Records,Page,4 of 6 Updated @ 3/28/2026,3:20:00,AM
2603230150,03/23/2026,16:18,200,BLK CONTRA COSTA ST FAMILY DISTURBANCE 5 GENERAL,SERVICE,PROVIDED
2603230154,03/23/2026,16:35,STANFORD,DR/MINI DR RECKLESS DRIVER 8,ALERT,BROADCAST
2603230156,03/23/2026,16:35,00,BLK CAROLINA DR TRAFFIC CONTROL / STRUCTURE FIRE CANCELLED,BY,DISPATCH
2603230157,03/23/2026,16:41,100,BLK AMADOR ST TRANSPORT ARRESTED PERSON 4 REFERRED TO,ANOTHER,AGENCY
2603230158,03/23/2026,16:42,1900,BLK SANTA CLARA ST AUDIBLE ALARM,6,UNFOUNDED
2603230160,03/23/2026,16:57,VIRGINIA,ST/SONOMA BL PROSTITUTION COMPLAINT 5 UNABLE,TO,LOCATE
2603230162,03/23/2026,17:06,1800,BLK GEORGIA ST VERBAL FIGHT 5 GENERAL,SERVICE,PROVIDED
2603230163,03/23/2026,17:10,2700,BLK TUOLUMNE ST ASSAULT REPORT 7 GENERAL,SERVICE,PROVIDED
2603230164,03/23/2026,17:13,100,BLK DYER CT WELFARE CHECK 2 REFERRED TO,ANOTHER,AGENCY
2603230166,03/23/2026,17:43,SKYLINE,DR/ROUNDHILL CT INFORMATIONAL REPORT 1 GENERAL,SERVICE,PROVIDED
2603230167,03/23/2026,17:59,4600,BLK GEORGIA ST INFORMATIONAL REPORT 2 GENERAL,SERVICE,PROVIDED
2603230168,03/23/2026,18:01,100,BLK ODDSTAD DR AUDIBLE ALARM,7,UNFOUNDED
2603230170,03/23/2026,18:10,800,BLK FOOTHILL DR SUSPICIOUS VEHICLE CHECK 1 GENERAL,SERVICE,PROVIDED
2603230172,03/23/2026,18:21,1500,BLK FLAGSHIP DR NOISE COMPLAINT 6 UNABLE,TO,LOCATE
2603230173,03/23/2026,18:22,4300,BLK SONOMA BL VERBAL FIGHT 7 GENERAL,SERVICE,PROVIDED
2603230174,03/23/2026,18:45,1500,BLK FLAGSHIP DR TRESPASS IN PROGRESS 6 GENERAL,SERVICE,PROVIDED
2603230175,03/23/2026,18:46,100,BLK AMADOR ST 911 HANGUP 4 UNABLE,TO,LOCATE
2603230176,03/23/2026,18:47,100,BLK HILLVIEW DR PARKING VIOLATION 1 UNABLE,TO,LOCATE
2603230177,03/23/2026,18:47,1100,BLK PORTER ST WELFARE CHECK 4 UNABLE,TO,LOCATE
2603230178,03/23/2026,18:57,1000,BLK STERLING ST 911 HANGUP 1 CANCELLED BY,REPORTING,PARTY
2603230180,03/23/2026,19:00,100,BLK AVIAN DR NEIGHBORHOOD DISPUTE 2 GENERAL,SERVICE,PROVIDED
2603230181,03/23/2026,19:15,200,BLK WINDSOR WY SUSPICIOUS VEHICLE CHECK 2 UNABLE,TO,LOCATE
2603230182,03/23/2026,19:20,1200,BLK MAPLE AV SUSPICIOUS VEHICLE CHECK 1 GENERAL,SERVICE,PROVIDED
2603230183,03/23/2026,19:21,100,BLK CAROLINA ST JUVENILE DISTURBANCE 6 UNABLE,TO,LOCATE
2603230184,03/23/2026,19:33,400,BLK GEORGIA ST PARKING VIOLATION 6 UNABLE,TO,LOCATE
2603230187,03/23/2026,19:51,2200,BLK TENNESSEE ST VERBAL FIGHT 2 GENERAL,SERVICE,PROVIDED
2603230190,03/23/2026,20:02,100,BLK ARGUELLO AV FOLLOW UP,3,REPORT
2603230191,03/23/2026,20:04,600,BLK DEL MAR AV PANIC ALARM,7,UNFOUNDED
2603230192,03/23/2026,20:09,100,BLK CYNTHIA AV RAVEN ALERT SHOTS FIRED 8 UNABLE,TO,LOCATE
Total,172,Records,Page,5 of 6 Updated @ 3/28/2026,3:20:00,AM
2603230193,03/23/2026,20:18,500,BLK SANTA CLARA ST AUDIBLE ALARM 6 UNABLE,TO,LOCATE
2603230194,03/23/2026,20:18,1900,BLK ASCOT PKY INFORMATIONAL REPORT 2 CANCELLED,BY,DISPATCH
2603230195,03/23/2026,20:26,100,BLK OLYMPIC DR VEHICLE THEFT REPORT,8,REPORT
2603230196,03/23/2026,20:26,1800,BLK SPRINGS RD AUDIBLE ALARM 2 GENERAL,SERVICE,PROVIDED
2603230197,03/23/2026,20:29,1000,BLK MAGAZINE ST 911 HANGUP 3 UNABLE,TO,LOCATE
2603230198,03/23/2026,20:30,1100,BLK ADMIRAL CALLAGHAN LN WELFARE CHECK 1 CANCELLED BY,REPORTING,PARTY
2603230199,03/23/2026,20:32,500,BLK MINI DR 911 HANGUP 8 UNABLE,TO,LOCATE
2603230200,03/23/2026,20:32,200,BLK MARE ISLAND WY WELFARE CHECK 6 General Services Mobile,Crisis,Involved
2603230201,03/23/2026,20:41,TENNESSEE,ST/TUOLUMNE ST TRAFFIC COLLISION / NO DETAILS 5 CANCELLED,BY,DISPATCH
2603230202,03/23/2026,20:42,TENNESSEE,ST/MARIPOSA ST INJURY COLLISION WITH EXTRICATION,5,REPORT
2603230206,03/23/2026,20:49,100,BLK ODDSTAD DR EXTRA PATROL 7 GENERAL,SERVICE,PROVIDED
2603230207,03/23/2026,20:50,100,BLK W LINCOLN RD NOISE COMPLAINT 4 UNABLE,TO,LOCATE
2603230208,03/23/2026,20:59,1100,BLK LEGEND CIR MISSING JUVENILE,1,REPORT
2603230209,03/23/2026,21:08,100,BLK LINCOLN RD E AREA CHECK 3 UNABLE,TO,LOCATE
2603230210,03/23/2026,21:20,100,BLK CYNTHIA AV RAVEN ALERT SHOTS FIRED 8 UNABLE,TO,LOCATE
2603230211,03/23/2026,21:52,900,BLK TUOLUMNE ST RETURNED MISSING PERSON,5,REPORT
2603230212,03/23/2026,22:14,100,BLK TEMPLE WY 911 HANGUP 1 UNABLE,TO,LOCATE
2603230213,03/23/2026,22:15,1000,BLK BENICIA RD POLICE COLLABORATE TRANSFER 2 REFERRED TO,ANOTHER,AGENCY
2603230214,03/23/2026,22:16,600,BLK 5TH ST WELFARE CHECK 4 UNABLE,TO,LOCATE
2603230217,03/23/2026,22:24,800,BLK STANFORD DR INTEGRATED HEALTH AND RESPONSE TEAM 8 MH TEAM,-IHART,PRIMARY
2603230218,03/23/2026,22:25,1100,BLK ADMIRAL CALLAGHAN LN VANDALISM REPORT 1 GENERAL,SERVICE,PROVIDED
2603230219,03/23/2026,22:27,00,BLK BALBOA AV FAMILY DISTURBANCE 2 GENERAL,SERVICE,PROVIDED
2603230220,03/23/2026,22:45,1000,BLK GRANT ST WELFARE CHECK 4 GENERAL,SERVICE,PROVIDED
2603230221,03/23/2026,23:04,100,BLK HILBORN ST TRESPASS IN PROGRESS 6 GENERAL,SERVICE,PROVIDED
2603230222,03/23/2026,23:22,100,BLK ROSE CT 911 HANGUP 8 UNABLE,TO,LOCATE
2603230223,03/23/2026,23:28,2200,BLK GRIFFIN DR AUDIBLE ALARM,8,UNFOUNDED
2603230225,03/23/2026,23:54,1400,BLK LOUISIANA ST INFORMATIONAL REPORT 5 CANCELLED,BY,DISPATCH
2603230226,03/23/2026,23:56,KATHY,ELLEN DR/ADMIRAL CALLAGHAN LN SUSPICIOUS PERSON 1 UNABLE,TO,LOCATE
Total,172,Records,Page,6 of 6 Updated @ 3/28/2026,3:20:00,AM
